<?xml version="1.0" encoding="ISO-8859-1"?>
<programming_library xmlns:xsi="http://www.w3.org/2001/XMLSchema-instance"
            xsi:noNamespaceSchemaLocation="programming_library.xsd">
    <language dificultad="sencillo" trending="alto">
        <name>Python</name>
        <creator>Guido van Rossum</creator>
        <year_created>1991</year_created>
        <description>Lenguaje de programación interpretado y de alto nivel.</description>
        <day_created>11</day_created>
    </language>

    <language dificultad="sencillo">
        <name>Java</name>
        <creator>James Gosling</creator>
        <year_created>1995</year_created>
        <description>Lenguaje orientado a objetos</description>
        <day_created>11</day_created>
    </language>
    
    <language dificultad="sencillo">
        <name>JavaScript</name>
        <creator>Brendan Eich</creator>
        <year_created>1995</year_created>
        <description>Lenguaje de programación interpretado, dialecto del estándar ECMAScript.</description>
        <day_created>11</day_created>
    </language>

</programming_library>  